{
  "schema_version": "m7_regression_report_v1",
  "generated_at": "2026-03-03T14:03:06.353229",
  "git_sha": "8892e72",
  "baseline_exp_id": "baseline",
  "primary_metric": "pinball_loss.overall",
  "thresholds": {
    "improvement_pct": 1.0,
    "regression_pct": 5.0
  },
  "baseline": {
    "exp_id": "baseline",
    "primary_mean": 0.134178,
    "primary_std": 0.010631,
    "n_seeds": 3
  },
  "comparisons": [
    {
      "exp_id": "batch_256",
      "primary_mean": 0.133383,
      "primary_std": 0.011707,
      "n_seeds": 3,
      "delta": -0.000795,
      "delta_pct": -0.59,
      "verdict": "neutral"
    },
    {
      "exp_id": "steps_1000",
      "primary_mean": 0.134178,
      "primary_std": 0.010631,
      "n_seeds": 3,
      "delta": 0.0,
      "delta_pct": 0.0,
      "verdict": "neutral"
    },
    {
      "exp_id": "no_clip",
      "primary_mean": 0.135976,
      "primary_std": 0.010437,
      "n_seeds": 3,
      "delta": 0.001798,
      "delta_pct": 1.34,
      "verdict": "neutral"
    }
  ],
  "summary": {
    "total_ablations": 3,
    "improved": 0,
    "neutral": 3,
    "regressed": 0
  }
}